{
  "app_version": "1.2.3",
  "build_id": "4f2a1c9",
  "capabilities": [
    "queue-state",
    "play-items-start-idx",
    "status-only",
    "lifecycle-shutdown",
    "unified-queue",
    "abs-queue",
    "abs-progress",
    "abs-book-queue",
    "abs-book-progress",
    "owner-queue-load",
    "answered-queue-ops",
    "queue-shuffle",
    "owner-action"
  ],
  "control_token": null,
  "protocol_version": 10,
  "swap_token": null
}
